{"id":"0192d6a0-7c00-7abc-8def-0123456789ab","v":1,"site_id":"navoiy-mol-bozori","agent_id":"agt-01","seq":42,"occurred_at":"2026-10-29T06:15:00+05:00","clock_ok":true,"type":"livestock.count.observed","data":{"gate_id":"darvoza-1","direction":"in","camera_class":"small","count":37,"confidence":88}}
