{"id":"0192d6a0-7c00-7abc-8def-0123456789ab","v":1,"site_id":"navoiy-mol-bozori","agent_id":"agt-01","seq":42,"occurred_at":"2026-10-29T06:15:00+05:00","clock_ok":true,"type":"livestock.vehicle.entered","data":{"vehicle_id":"0b7c2a52-6a0e-4d43-9a7e-3f1f0c9d2b11","gate_id":"darvoza-1","plate":"85A123BC","confidence":91,"file_id":"0123456789abcdef0123456789abcdef0123456789abcdef0123456789abcdef"}}
