{"id":"0192d6a0-7c00-7abc-8def-0123456789ab","v":1,"site_id":"navoiy-mol-bozori","agent_id":"agt-01","seq":42,"occurred_at":"2026-10-29T06:15:00+05:00","clock_ok":true,"type":"core.payment.cash","correlation_id":"0b7c2a52-6a0e-4d43-9a7e-3f1f0c9d2b11","data":{"payment_id":"5f0f8a3e-1d2c-4b5a-9e8f-7a6b5c4d3e2f","amount_soum":5000,"method":"cash","subject":{"kind":"parking_session","id":"0b7c2a52-6a0e-4d43-9a7e-3f1f0c9d2b11"},"staff_id":"u-17","ikpu":"10305008002000000","package_code":"1503777","fiscal_status":"manual"}}
