{"id":"0192d6a0-7c00-7abc-8def-0123456789ab","v":1,"site_id":"navoiy-mol-bozori","agent_id":"agt-01","seq":42,"occurred_at":"2026-10-29T06:15:00+05:00","clock_ok":true,"type":"market.occupancy.observed","data":{"slot":"08:00","stalls":[{"stall_code":"5","verdict":"occupied","confidence":93},{"stall_code":"6","verdict":"uncertain"}]}}
